[
  {
    "id": "overview-cadastros",
    "title": "Visão geral - Cadastros",
    "category": "Categorias",
    "module": "Cadastros",
    "source_type": "community_max_json_otimizado",
    "source": {
      "name": "Categorias > Cadastros",
      "file": "categorias/cadastros.json",
      "url": null,
      "status": "mapeado"
    },
    "document_type": "module_overview",
    "question_examples": [
      "O que existe no módulo Cadastros?",
      "Quando usar Cadastros?"
    ],
    "keywords": [
      "cadastros",
      "cadastros mestres",
      "classificação contábil de clientes, fornecedores e transportadoras",
      "clientes",
      "dispositivos",
      "edição do layout do e-mail automático para boletos de cobrança",
      "fornecedores",
      "layout de e-mail",
      "liberação e gestão de dispositivos móveis no maxmanager app",
      "transportadoras"
    ],
    "process": {
      "name": "Cadastros",
      "objective": "Orientar dúvidas relacionadas a Cadastros.",
      "steps": [],
      "critical_rules": [],
      "dependencies": []
    },
    "answer_guidelines": [
      "Assumir esta aba como base mestre de entidades do ERP.",
      "Quando houver dúvida sobre pré-requisitos de módulos, validar se depende de cadastro.",
      "Ressaltar impacto de cadastro incorreto em faturamento, financeiro, fiscal e integração."
    ],
    "content": "Módulo/Aba: Categorias > Cadastros\n\nTipo de fonte: Categorias\n\nStatus de mapeamento: mapeado\n\nQuantidade de publicações observadas no Community Max: 62\n\nFoco funcional:\n- cadastros mestres\n- clientes\n- fornecedores\n- transportadoras\n- dispositivos\n- layout de e-mail\n\nTópicos observados:\n- edição do layout do e-mail automático para boletos de cobrança\n- classificação contábil de clientes, fornecedores e transportadoras\n- liberação e gestão de dispositivos móveis no MaxManager App\n\nInstruções para resposta da IA:\n- Assumir esta aba como base mestre de entidades do ERP.\n- Quando houver dúvida sobre pré-requisitos de módulos, validar se depende de cadastro.\n- Ressaltar impacto de cadastro incorreto em faturamento, financeiro, fiscal e integração.\n\nUso recomendado: utilizar este conteúdo para classificar dúvidas, identificar o módulo provável e orientar respostas iniciais. Se a pergunta exigir passo a passo detalhado e não houver processo específico nesta base, criar lacuna de conhecimento ou consultar fonte autorizada.",
    "metadata": {
      "optimized_for": "SAGAI_RAG",
      "created_at": "2026-04-24T14:28:08.062203Z",
      "original_file": "categorias/cadastros.json",
      "confidence_level": "base_mapeada"
    }
  }
]