[
  {
    "id": "bi::business_intelligence_reporting",
    "title": "Business intelligence, relatórios e analytics",
    "category": "SAP B1 > BI e Relatórios",
    "module": "BI, Relatórios e Analytics",
    "source_type": "sap_official_web_summary_rag_seed",
    "source": {
      "name": "SAP Business One - features + SAP Business One - product overview",
      "urls": [
        "https://www.sap.com/products/erp/business-one/features.html",
        "https://www.sap.com/products/erp/business-one.html"
      ],
      "publishers": [
        "SAP"
      ],
      "status": "fonte_externa_resumida_para_seed_rag",
      "copyright_note": "Conteúdo resumido/parafraseado para treinamento RAG; não é transcrição integral da documentação."
    },
    "document_type": "module_overview",
    "question_examples": [
      "SAP B1 tem BI?",
      "Como gerar relatórios no SAP B1?",
      "O que são dashboards no SAP B1?"
    ],
    "keywords": [
      "BI",
      "Business Intelligence",
      "Crystal Reports",
      "Excel",
      "KPI",
      "analytics",
      "dashboard",
      "predefined metrics",
      "real-time analytics",
      "relatórios",
      "visualizações"
    ],
    "process": {
      "name": "Business intelligence, relatórios e analytics",
      "objective": "Explicar como SAP B1 apoia análise gerencial e operacional.",
      "steps": [
        "Identificar pergunta gerencial.",
        "Selecionar relatório, consulta ou dashboard.",
        "Filtrar período, parceiro, item, armazém ou projeto.",
        "Analisar KPI e drill-down quando disponível."
      ],
      "critical_rules": [
        "Relatório depende da qualidade dos dados transacionais e cadastros.",
        "Se relatório não bate, revisar documentos de origem e filtros antes de concluir erro."
      ],
      "dependencies": [
        "Todos os módulos operacionais e financeiro."
      ]
    },
    "answer_guidelines": [
      "Responder como base de conhecimento RAG, citando que a fonte é SAP Business One quando aplicável.",
      "Se a pergunta pedir passo a passo operacional detalhado e este chunk não trouxer a sequência exata, responder com visão geral e sinalizar necessidade de documentação específica.",
      "Evitar misturar SAP Business One com SAP S/4HANA, SAP ECC ou Business ByDesign, salvo quando o usuário pedir comparação.",
      "Para processos fiscais/localização, reforçar que regras dependem de país, versão, parametrização e legislação vigente."
    ],
    "content": "Módulo: BI, Relatórios e Analytics\n\nObjetivo: Explicar como SAP B1 apoia análise gerencial e operacional.\n\nEscopo funcional:\n- SAP B1 inclui ferramentas para criar relatórios com dados da empresa, dashboards e análises em tempo real.\n- Relatórios podem cobrir vendas, finanças, estoque, compras, entregas, caixa, custos e outros processos.\n- Integração com recursos como Excel, layouts e visualizações ajuda usuários a explorar dados com menor dependência de TI.\n\nEntidades e documentos relevantes:\n- dashboard\n- relatório\n- KPI\n- query\n- Crystal Reports\n- Excel\n- analytics\n- template\n\nFluxos principais:\n- Identificar pergunta gerencial.\n- Selecionar relatório, consulta ou dashboard.\n- Filtrar período, parceiro, item, armazém ou projeto.\n- Analisar KPI e drill-down quando disponível.\n\nRegras e observações para resposta da IA:\n- Relatório depende da qualidade dos dados transacionais e cadastros.\n- Se relatório não bate, revisar documentos de origem e filtros antes de concluir erro.\n\nDependências/correlações com outros módulos:\n- Todos os módulos operacionais e financeiro.\n\nQuando sinalizar lacuna de conhecimento:\n- Quando a dúvida exigir campo específico, atalho de tela, regra legal local ou comportamento de versão não coberto pela fonte resumida.\n- Quando houver divergência entre parametrização real do cliente e documentação genérica.",
    "metadata": {
      "optimized_for": "SAGAI_RAG",
      "domain": "SAP Business One",
      "module_slug": "bi",
      "granularity": "module_chunk",
      "language": "pt-BR",
      "created_at": "2026-04-29T00:00:00Z",
      "version": "sap_b1_seed_v1_2026-04-29",
      "confidence_level": "alta",
      "curation_status": "seed_externo_precisa_validacao_humana_antes_de_base_oficial",
      "source_count": 2,
      "aliases": [
        "BI",
        "BI, Relatórios e Analytics",
        "Business Intelligence",
        "Crystal Reports",
        "Excel",
        "KPI",
        "SAP B1",
        "SAP Business One",
        "analytics",
        "dashboard",
        "predefined metrics",
        "real-time analytics",
        "relatórios",
        "visualizações"
      ],
      "suggested_collection": "sap_b1",
      "import_path_recommendation": "backend/knowledge/json/sap_b1/sap_b1_12_bi_relatorios_analytics.sagai.json",
      "source_license_handling": "summary_only_do_not_treat_as_full_sap_documentation",
      "validation_required": true
    }
  },
  {
    "id": "bi::indicadores_por_modulo",
    "title": "Indicadores e perguntas analíticas por módulo",
    "category": "SAP B1 > BI e Relatórios",
    "module": "BI, Relatórios e Analytics",
    "source_type": "sap_official_web_summary_rag_seed",
    "source": {
      "name": "SAP Business One - features",
      "urls": [
        "https://www.sap.com/products/erp/business-one/features.html"
      ],
      "publishers": [
        "SAP"
      ],
      "status": "fonte_externa_resumida_para_seed_rag",
      "copyright_note": "Conteúdo resumido/parafraseado para treinamento RAG; não é transcrição integral da documentação."
    },
    "document_type": "intent_routing",
    "question_examples": [
      "Quais vendas foram entregues no prazo?",
      "Como analisar caixa?",
      "Como ver estoque parado?",
      "Como acompanhar pipeline?"
    ],
    "keywords": [
      "KPI",
      "análise de entrega",
      "análise de vendas",
      "compras",
      "fluxo de caixa",
      "indicador",
      "pipeline",
      "produção",
      "saldo de estoque",
      "serviços"
    ],
    "process": {
      "name": "Indicadores e perguntas analíticas por módulo",
      "objective": "Ajudar o RAG a direcionar perguntas analíticas para o módulo correto.",
      "steps": [
        "Classificar pergunta por métrica.",
        "Localizar documentos de origem.",
        "Aplicar filtros.",
        "Explicar resultado e limitações."
      ],
      "critical_rules": [
        "Não inventar nome exato de relatório sem fonte específica.",
        "Preferir orientação conceitual se a base não possuir manual da tela."
      ],
      "dependencies": [
        "Módulo funcional correspondente."
      ]
    },
    "answer_guidelines": [
      "Responder como base de conhecimento RAG, citando que a fonte é SAP Business One quando aplicável.",
      "Se a pergunta pedir passo a passo operacional detalhado e este chunk não trouxer a sequência exata, responder com visão geral e sinalizar necessidade de documentação específica.",
      "Evitar misturar SAP Business One com SAP S/4HANA, SAP ECC ou Business ByDesign, salvo quando o usuário pedir comparação.",
      "Para processos fiscais/localização, reforçar que regras dependem de país, versão, parametrização e legislação vigente."
    ],
    "content": "Módulo: BI, Relatórios e Analytics\n\nObjetivo: Ajudar o RAG a direcionar perguntas analíticas para o módulo correto.\n\nEscopo funcional:\n- Vendas: pipeline, cotação, pedido, entrega, faturamento, margem e clientes.\n- Financeiro: caixa, contas em aberto, receita, custo, orçamento, auditoria e centros de custo.\n- Estoque: saldo, giro, lote/série, transferência, contagem e custo.\n- Compras: pedidos, recebimentos, fornecedores, custos, prazos e contas a pagar.\n- Serviços/Projetos: chamados, contratos, custos, progresso, pendências e desempenho.\n\nEntidades e documentos relevantes:\n- KPI\n- dashboard\n- report\n- module\n- filter\n\nFluxos principais:\n- Classificar pergunta por métrica.\n- Localizar documentos de origem.\n- Aplicar filtros.\n- Explicar resultado e limitações.\n\nRegras e observações para resposta da IA:\n- Não inventar nome exato de relatório sem fonte específica.\n- Preferir orientação conceitual se a base não possuir manual da tela.\n\nDependências/correlações com outros módulos:\n- Módulo funcional correspondente.\n\nQuando sinalizar lacuna de conhecimento:\n- Quando a dúvida exigir campo específico, atalho de tela, regra legal local ou comportamento de versão não coberto pela fonte resumida.\n- Quando houver divergência entre parametrização real do cliente e documentação genérica.",
    "metadata": {
      "optimized_for": "SAGAI_RAG",
      "domain": "SAP Business One",
      "module_slug": "bi",
      "granularity": "module_chunk",
      "language": "pt-BR",
      "created_at": "2026-04-29T00:00:00Z",
      "version": "sap_b1_seed_v1_2026-04-29",
      "confidence_level": "média",
      "curation_status": "seed_externo_precisa_validacao_humana_antes_de_base_oficial",
      "source_count": 1,
      "aliases": [
        "BI, Relatórios e Analytics",
        "KPI",
        "SAP B1",
        "SAP Business One",
        "análise de entrega",
        "análise de vendas",
        "compras",
        "fluxo de caixa",
        "indicador",
        "pipeline",
        "produção",
        "saldo de estoque",
        "serviços"
      ],
      "suggested_collection": "sap_b1",
      "import_path_recommendation": "backend/knowledge/json/sap_b1/sap_b1_12_bi_relatorios_analytics.sagai.json",
      "source_license_handling": "summary_only_do_not_treat_as_full_sap_documentation",
      "validation_required": true
    }
  }
]