[
  {
    "id": "overview-marketing",
    "title": "Visão geral - Marketing",
    "category": "Categorias",
    "module": "Marketing",
    "source_type": "community_max_json_otimizado",
    "source": {
      "name": "Categorias > Marketing",
      "file": "categorias/marketing.json",
      "url": null,
      "status": "mapeado"
    },
    "document_type": "module_overview",
    "question_examples": [
      "O que existe no módulo Marketing?",
      "Quando usar Marketing?"
    ],
    "keywords": [
      "marketing",
      "mensagens internas",
      "quadro de avisos",
      "quadro de avisos e mensagens"
    ],
    "process": {
      "name": "Marketing",
      "objective": "Orientar dúvidas relacionadas a Marketing.",
      "steps": [],
      "critical_rules": [],
      "dependencies": []
    },
    "answer_guidelines": [
      "Tratar esta aba como comunicação interna/aviso sistêmico, não como marketing externo."
    ],
    "content": "Módulo/Aba: Categorias > Marketing\n\nTipo de fonte: Categorias\n\nStatus de mapeamento: mapeado\n\nQuantidade de publicações observadas no Community Max: 1\n\nFoco funcional:\n- quadro de avisos\n- mensagens internas\n\nTópicos observados:\n- quadro de avisos e mensagens\n\nInstruções para resposta da IA:\n- Tratar esta aba como comunicação interna/aviso sistêmico, não como marketing externo.\n\nUso recomendado: utilizar este conteúdo para classificar dúvidas, identificar o módulo provável e orientar respostas iniciais. Se a pergunta exigir passo a passo detalhado e não houver processo específico nesta base, criar lacuna de conhecimento ou consultar fonte autorizada.",
    "metadata": {
      "optimized_for": "SAGAI_RAG",
      "created_at": "2026-04-24T14:28:08.080204Z",
      "original_file": "categorias/marketing.json",
      "confidence_level": "base_mapeada"
    }
  }
]