[
  {
    "id": "projetos::project_management",
    "title": "Gestão de projetos no SAP Business One",
    "category": "SAP B1 > Projetos",
    "module": "Projetos",
    "source_type": "sap_official_web_summary_rag_seed",
    "source": {
      "name": "How to Work with Project Management in SAP Business One + SAP Business One - features",
      "urls": [
        "https://help.sap.com/doc/46e99943f725466a87f40799f9761ddb/10.0/en-US/How_to_Work_with_Project_Management_in_SAP_Business_One.pdf",
        "https://www.sap.com/products/erp/business-one/features.html"
      ],
      "publishers": [
        "SAP",
        "SAP Help Portal"
      ],
      "status": "fonte_externa_resumida_para_seed_rag",
      "copyright_note": "Conteúdo resumido/parafraseado para treinamento RAG; não é transcrição integral da documentação."
    },
    "document_type": "module_overview",
    "question_examples": [
      "SAP B1 tem gestão de projetos?",
      "Como controlar custos de projeto no SAP B1?",
      "O que são etapas de projeto?"
    ],
    "keywords": [
      "Project Management",
      "activity",
      "budget",
      "cost",
      "open issues",
      "project",
      "projetos",
      "resources",
      "stage",
      "stage analysis",
      "subproject",
      "task"
    ],
    "process": {
      "name": "Gestão de projetos no SAP Business One",
      "objective": "Explicar a gestão centralizada de projetos, fases, custos e documentos.",
      "steps": [
        "Criar projeto e estrutura hierárquica.",
        "Definir estágios, datas e responsáveis.",
        "Relacionar documentos, atividades e recursos.",
        "Acompanhar custos, orçamento e progresso.",
        "Gerar relatórios de análise."
      ],
      "critical_rules": [
        "Quando projeto envolver faturamento, recuperar Vendas/Financeiro.",
        "Quando envolver custo de produção, recuperar Produção/Estoque.",
        "Não confundir módulo Projetos do SAP B1 com SAP Project System do S/4HANA/ECC."
      ],
      "dependencies": [
        "Financeiro, Vendas, Compras, Produção, Recursos e BI."
      ]
    },
    "answer_guidelines": [
      "Responder como base de conhecimento RAG, citando que a fonte é SAP Business One quando aplicável.",
      "Se a pergunta pedir passo a passo operacional detalhado e este chunk não trouxer a sequência exata, responder com visão geral e sinalizar necessidade de documentação específica.",
      "Evitar misturar SAP Business One com SAP S/4HANA, SAP ECC ou Business ByDesign, salvo quando o usuário pedir comparação.",
      "Para processos fiscais/localização, reforçar que regras dependem de país, versão, parametrização e legislação vigente."
    ],
    "content": "Módulo: Projetos\n\nObjetivo: Explicar a gestão centralizada de projetos, fases, custos e documentos.\n\nEscopo funcional:\n- O módulo de projetos centraliza transações, documentos, recursos, atividades e custos relacionados a um projeto.\n- Pode organizar projetos em estrutura hierárquica com subprojetos, estágios/fases, tarefas e marcos.\n- Ajuda a monitorar progresso, orçamento, custos reais, problemas em aberto e relatórios de análise.\n\nEntidades e documentos relevantes:\n- Project\n- Subproject\n- Stage\n- Task\n- Activity\n- Resource\n- Budget\n- Cost\n- Issue\n- Report\n\nFluxos principais:\n- Criar projeto e estrutura hierárquica.\n- Definir estágios, datas e responsáveis.\n- Relacionar documentos, atividades e recursos.\n- Acompanhar custos, orçamento e progresso.\n- Gerar relatórios de análise.\n\nRegras e observações para resposta da IA:\n- Quando projeto envolver faturamento, recuperar Vendas/Financeiro.\n- Quando envolver custo de produção, recuperar Produção/Estoque.\n- Não confundir módulo Projetos do SAP B1 com SAP Project System do S/4HANA/ECC.\n\nDependências/correlações com outros módulos:\n- Financeiro, Vendas, Compras, Produção, Recursos e BI.\n\nQuando sinalizar lacuna de conhecimento:\n- Quando a dúvida exigir campo específico, atalho de tela, regra legal local ou comportamento de versão não coberto pela fonte resumida.\n- Quando houver divergência entre parametrização real do cliente e documentação genérica.",
    "metadata": {
      "optimized_for": "SAGAI_RAG",
      "domain": "SAP Business One",
      "module_slug": "projetos",
      "granularity": "module_chunk",
      "language": "pt-BR",
      "created_at": "2026-04-29T00:00:00Z",
      "version": "sap_b1_seed_v1_2026-04-29",
      "confidence_level": "alta",
      "curation_status": "seed_externo_precisa_validacao_humana_antes_de_base_oficial",
      "source_count": 2,
      "aliases": [
        "Project Management",
        "Projetos",
        "SAP B1",
        "SAP Business One",
        "activity",
        "budget",
        "cost",
        "open issues",
        "project",
        "projetos",
        "resources",
        "stage",
        "stage analysis",
        "subproject",
        "task"
      ],
      "suggested_collection": "sap_b1",
      "import_path_recommendation": "backend/knowledge/json/sap_b1/sap_b1_11_projetos.sagai.json",
      "source_license_handling": "summary_only_do_not_treat_as_full_sap_documentation",
      "validation_required": true
    }
  },
  {
    "id": "projetos::custos_orcamento_relatorios",
    "title": "Custos, orçamento e relatórios de projeto",
    "category": "SAP B1 > Projetos",
    "module": "Projetos",
    "source_type": "sap_official_web_summary_rag_seed",
    "source": {
      "name": "How to Work with Project Management in SAP Business One",
      "urls": [
        "https://help.sap.com/doc/46e99943f725466a87f40799f9761ddb/10.0/en-US/How_to_Work_with_Project_Management_in_SAP_Business_One.pdf"
      ],
      "publishers": [
        "SAP Help Portal"
      ],
      "status": "fonte_externa_resumida_para_seed_rag",
      "copyright_note": "Conteúdo resumido/parafraseado para treinamento RAG; não é transcrição integral da documentação."
    },
    "document_type": "process_overview",
    "question_examples": [
      "Como analisar custo real de projeto?",
      "SAP B1 mostra variação de projeto?",
      "Como ver relatório de etapa do projeto?"
    ],
    "keywords": [
      "actual cost",
      "budget cost",
      "direct profit",
      "project cost",
      "project reports",
      "stage analysis",
      "variance",
      "work order costs"
    ],
    "process": {
      "name": "Custos, orçamento e relatórios de projeto",
      "objective": "Dar contexto para dúvidas de acompanhamento financeiro e operacional de projetos.",
      "steps": [
        "Relacionar documentos/transações ao projeto.",
        "Acompanhar custos por etapa ou subprojeto.",
        "Comparar orçamento x realizado.",
        "Analisar variações e pendências."
      ],
      "critical_rules": [
        "Não afirmar origem exata de custo sem documento associado.",
        "Para interpretação contábil, recuperar Financeiro e Cadastros."
      ],
      "dependencies": [
        "Financeiro, Compras, Produção, Vendas."
      ]
    },
    "answer_guidelines": [
      "Responder como base de conhecimento RAG, citando que a fonte é SAP Business One quando aplicável.",
      "Se a pergunta pedir passo a passo operacional detalhado e este chunk não trouxer a sequência exata, responder com visão geral e sinalizar necessidade de documentação específica.",
      "Evitar misturar SAP Business One com SAP S/4HANA, SAP ECC ou Business ByDesign, salvo quando o usuário pedir comparação.",
      "Para processos fiscais/localização, reforçar que regras dependem de país, versão, parametrização e legislação vigente."
    ],
    "content": "Módulo: Projetos\n\nObjetivo: Dar contexto para dúvidas de acompanhamento financeiro e operacional de projetos.\n\nEscopo funcional:\n- Custos podem ser acumulados por documentos, atividades, ordens ou recursos vinculados ao projeto, dependendo do cenário.\n- Indicadores de orçamento, custo real e variação ajudam a monitorar rentabilidade e execução.\n- Relatórios por estágio, problema ou recurso ajudam a identificar atraso, custo e pendência.\n\nEntidades e documentos relevantes:\n- budget\n- actual cost\n- variance\n- direct profit\n- work order\n- stage\n- resource\n\nFluxos principais:\n- Relacionar documentos/transações ao projeto.\n- Acompanhar custos por etapa ou subprojeto.\n- Comparar orçamento x realizado.\n- Analisar variações e pendências.\n\nRegras e observações para resposta da IA:\n- Não afirmar origem exata de custo sem documento associado.\n- Para interpretação contábil, recuperar Financeiro e Cadastros.\n\nDependências/correlações com outros módulos:\n- Financeiro, Compras, Produção, Vendas.\n\nQuando sinalizar lacuna de conhecimento:\n- Quando a dúvida exigir campo específico, atalho de tela, regra legal local ou comportamento de versão não coberto pela fonte resumida.\n- Quando houver divergência entre parametrização real do cliente e documentação genérica.",
    "metadata": {
      "optimized_for": "SAGAI_RAG",
      "domain": "SAP Business One",
      "module_slug": "projetos",
      "granularity": "module_chunk",
      "language": "pt-BR",
      "created_at": "2026-04-29T00:00:00Z",
      "version": "sap_b1_seed_v1_2026-04-29",
      "confidence_level": "média",
      "curation_status": "seed_externo_precisa_validacao_humana_antes_de_base_oficial",
      "source_count": 1,
      "aliases": [
        "Projetos",
        "SAP B1",
        "SAP Business One",
        "actual cost",
        "budget cost",
        "direct profit",
        "project cost",
        "project reports",
        "stage analysis",
        "variance",
        "work order costs"
      ],
      "suggested_collection": "sap_b1",
      "import_path_recommendation": "backend/knowledge/json/sap_b1/sap_b1_11_projetos.sagai.json",
      "source_license_handling": "summary_only_do_not_treat_as_full_sap_documentation",
      "validation_required": true
    }
  }
]