[
  {
    "id": "overview-comercio-exterior",
    "title": "Visão geral - Comércio Exterior",
    "category": "Categorias",
    "module": "Comércio Exterior",
    "source_type": "community_max_json_otimizado",
    "source": {
      "name": "Categorias > Comércio Exterior",
      "file": "categorias/comercio_exterior.json",
      "url": null,
      "status": "mapeado"
    },
    "document_type": "module_overview",
    "question_examples": [
      "O que existe no módulo Comércio Exterior?",
      "Quando usar Comércio Exterior?"
    ],
    "keywords": [
      "comercio-exterior",
      "comércio exterior",
      "conceitos de nota fiscal de importação",
      "conferência de nota fiscal de importação",
      "diferença entre unidade de comercialização e unidade tributável do ncm",
      "emissão de proforma invoice",
      "exportação",
      "importação",
      "ncm",
      "proforma invoice",
      "unidade tributável"
    ],
    "process": {
      "name": "Comércio Exterior",
      "objective": "Orientar dúvidas relacionadas a Comércio Exterior.",
      "steps": [],
      "critical_rules": [],
      "dependencies": []
    },
    "answer_guidelines": [
      "Cruzar conhecimento com Recebimentos, NF-e e Fiscal quando houver importação/exportação.",
      "Dar atenção à documentação comercial internacional e reflexos tributários."
    ],
    "content": "Módulo/Aba: Categorias > Comércio Exterior\n\nTipo de fonte: Categorias\n\nStatus de mapeamento: mapeado\n\nQuantidade de publicações observadas no Community Max: 7\n\nFoco funcional:\n- exportação\n- proforma invoice\n- importação\n- NCM\n- unidade tributável\n\nTópicos observados:\n- emissão de Proforma Invoice\n- conferência de nota fiscal de importação\n- diferença entre unidade de comercialização e unidade tributável do NCM\n- conceitos de nota fiscal de importação\n\nInstruções para resposta da IA:\n- Cruzar conhecimento com Recebimentos, NF-e e Fiscal quando houver importação/exportação.\n- Dar atenção à documentação comercial internacional e reflexos tributários.\n\nUso recomendado: utilizar este conteúdo para classificar dúvidas, identificar o módulo provável e orientar respostas iniciais. Se a pergunta exigir passo a passo detalhado e não houver processo específico nesta base, criar lacuna de conhecimento ou consultar fonte autorizada.",
    "metadata": {
      "optimized_for": "SAGAI_RAG",
      "created_at": "2026-04-24T14:28:08.062940Z",
      "original_file": "categorias/comercio_exterior.json",
      "confidence_level": "base_mapeada"
    }
  }
]